{
  "task_id": "FIX-TSK-001",
  "application_id": "FIX-APP-001",
  "contact_id": "FIX-CON-001",
  "task_type": "follow_up",
  "title": "Follow up on application",
  "description": "Synthetic operational task.",
  "due_at": "2026-06-15",
  "completed_at": "2026-06-16",
  "status": "completed",
  "priority": "high",
  "source": "synthetic",
  "recurrence": null,
  "notes": null,
  "created_at": "2026-07-18T00:00:00+05:30",
  "updated_at": "2026-07-18T00:00:00+05:30",
  "schema_version": "1.0.0"
}
